구분,질문,답변
전세,안녕하세요 부동산 일을 막 시작한 부린이 입니다.제가 한달 정도 됐는데 모르는게 너무 많습니다.1.전세계약은 왜 중개인이 반드시 필요한가?2.보증보험가입은 누가 가입을 해야하는가?알려주실 분 계신가요..ㅠ 너무 제 자신이 짜증나고 답답해서 올려봅니다그리고 부동산 관련해서 저의 멘토가 되어주실 분 댓글로 남겨주세요 ㅠ 도와주세요,안녕하세요. 서울지방변호사회-네이버 지식iN 상담 변호사 정종욱 입니다.​신탁등기된 부동산은 그렇지 않은 부동산보다 권리관계가 복잡하기 때문에 임대차 계약을 체결하실 때 많은 주의를 기울이셔야 합니다. 신탁등기된 부동산 임대차 계약 체결시 주의사항에 관해서는 아래 블로그 글 참고하시면 도움이 되실 것입니다. ​           [부동산전문변호사] 신탁 등기된 부동산 임대차 계약 체결시 주의사항은? 신탁 등기된 부동산 임대차 계약 체결시 주의사항 안녕하세요. 케이엔파트너스 부동산법률연구소 정종욱 변... blog.naver.com            ​
전세,"이번에 신축 오피스텔 전세계약을 하려고 하는데보니까 해당 물건이 신탁부동산매물이고등기부등본 갑구에 신탁원부라 기재되어 있더라고요그래서 전세계약 절차를 수행하려 하는데임대인(집주인)과 계약을 할 때, 아직 이전등기가 안되어 있기 때문에수탁자(부동산신탁주식회사)의 동의서가 필히 있어야 하는 것을 압니다..그래서 부동산 중개인에게 말했더니그건 다세대만 해당되는 거고아파트 및 오피스텔은 해당이 안된다고 하는데이게 맞는 것인가요???맞는 내용이라면 출처가 어떻게 되는지답변 감사합니다!!(내공100)부린이라 상세한 설명 해주시면 정말 감사합니다ㅠㅠ","전문 상담사 입니다.    정성 스럽게 작성하여 도움이 될 수 있도록 노력 하겠습니다.        질문에 대하여 답변 해드리겠습니다.        부동산 전세 계약에 대해 궁금한 점이 있어서 문의하셨습니다. 전세 계약금 입금 및 계약서 작성이 완료되었으며, 임대차 계약도 신고가 완료되었습니다. 하지만 아직 잔금을 치르기 전에 집주인이 아파트를 매매하려고 부동산 어플에 등록한 것을 알아차리셨습니다. 또한 계약서 작성 시에 집 매매에 대한 정보는 듣지 못하셨습니다.       이런 경우가 흔한지, 전세 계약 진행 중에 매매가 진행되는지에 대해 궁금하신 것 같습니다. 또한 양측 부동산이 아닌 제3 부동산이 매매 등록했는데 해당 사항에 문제가 없는지 궁금하신 것 같습니다. 그리고 본인 부동산에 어떤 내용을 확인해보는 것이 좋을지에 대한 조언을 원하시는 것 같습니다.       전세 계약 진행 중 매매가 이루어지는 경우는 드물지만 발생할 수 있습니다. 보다 안정적인 계약을 위해서는 부동산 관련 법률을 잘 숙지하고 전문가의 도움을 받는 것이 좋습니다. 양측 부동산이 아닌 제3 부동산이 매매 등록한 경우에는 해당 부동산의 신뢰성과 신용도를 확인하는 것이 중요합니다. 부동산 전문가나 법률 전문가의 조언을 듣는 것도 도움이 될 수 있습니다. 또한, 부동산에 등록된 정보와 해당 아파트의 현황, 관련 법규를 확인해보는 것도 좋은 방법입니다.       부동산 전문가 형누님들의 조언을 참고하시면 더욱 좋으실 것입니다. 부동산 계약에 대한 이해와 조언은 전문가에게 맡기는 것이 좋습니다. 감사합니다.        ※답변에 만족하셨다면 채택을 추가로 궁금하신점이 있으시다면 추가질문을 부탁드리겠습니다.※        좋은하루 되세요        https://codetofinance.com/%eb%b6%80%eb%8f%99%ec%82%b0-%ea%b1%b0%eb%9e%98%ea%b4%80%eb%a6%ac-%ec%8b%9c%ec%8a%a4%ed%85%9c-%ec%86%8c%ea%b0%9c/              부동산 거래관리 시스템 소개 부동산의달인 부동산 거래관리 시스템 소개 codetofinance.com            ​"
전세,[],"전문 상담사 입니다.    정성 스럽게 작성하여 도움이 될 수 있도록 노력 하겠습니다.        질문에 대하여 답변 해드리겠습니다.        부동산 전세 계약에 대해 궁금한 점이 있어서 문의하셨습니다. 전세 계약금 입금 및 계약서 작성이 완료되었으며, 임대차 계약도 신고가 완료되었습니다. 하지만 아직 잔금을 치르기 전에 집주인이 아파트를 매매하려고 부동산 어플에 등록한 것을 알아차리셨습니다. 또한 계약서 작성 시에 집 매매에 대한 정보는 듣지 못하셨습니다.       이런 경우가 흔한지, 전세 계약 진행 중에 매매가 진행되는지에 대해 궁금하신 것 같습니다. 또한 양측 부동산이 아닌 제3 부동산이 매매 등록했는데 해당 사항에 문제가 없는지 궁금하신 것 같습니다. 그리고 본인 부동산에 어떤 내용을 확인해보는 것이 좋을지에 대한 조언을 원하시는 것 같습니다.       전세 계약 진행 중 매매가 이루어지는 경우는 드물지만 발생할 수 있습니다. 보다 안정적인 계약을 위해서는 부동산 관련 법률을 잘 숙지하고 전문가의 도움을 받는 것이 좋습니다. 양측 부동산이 아닌 제3 부동산이 매매 등록한 경우에는 해당 부동산의 신뢰성과 신용도를 확인하는 것이 중요합니다. 부동산 전문가나 법률 전문가의 조언을 듣는 것도 도움이 될 수 있습니다. 또한, 부동산에 등록된 정보와 해당 아파트의 현황, 관련 법규를 확인해보는 것도 좋은 방법입니다.       부동산 전문가 형누님들의 조언을 참고하시면 더욱 좋으실 것입니다. 부동산 계약에 대한 이해와 조언은 전문가에게 맡기는 것이 좋습니다. 감사합니다.        ※답변에 만족하셨다면 채택을 추가로 궁금하신점이 있으시다면 추가질문을 부탁드리겠습니다.※        좋은하루 되세요        https://codetofinance.com/%eb%b6%80%eb%8f%99%ec%82%b0-%ea%b1%b0%eb%9e%98%ea%b4%80%eb%a6%ac-%ec%8b%9c%ec%8a%a4%ed%85%9c-%ec%86%8c%ea%b0%9c/              부동산 거래관리 시스템 소개 부동산의달인 부동산 거래관리 시스템 소개 codetofinance.com            ​"
전세,"안녕하세요. 신축 아파트 원 계약자로 저희 어머니가 계약을 하셨었는데, 현재 아파트 관련해서 여러 질문들이 있습니다.현재 계약서에 있는 금액은 은행에서 중도금 대출받은 1억 5천을 제외하곤 잔금까지 전부 완납했습니다.취득세도 해당 시청에서 납부하였는데요, 소유권 이전등기는 9월 중순까지 내야 가산세가 안붙는다고 해서 내려고 했더니 은행에 중도금 대출 상환을 하고 그 증명서를 제출해야 아파트쪽에서 승인을 내주어 그때부터 소유권 이전등기 신청이 가능해지고, 혹은 중도금 대출을 잔금대출로 바꾸어서 중도금 대출 쪽 은행은 상환하고, 잔금대출을 받은 은행으로 서류가 넘어가서 그쪽 법무사를 통해 소유권 이전등기 신청이 가능해진다고 알게되었습니다.이러한 상황에서 해당 아파트를 부동산 통하여 전세로 올려 놓았고 계약하겠다는 사람이 나타났는데이 세입자도 디딤돌 대출을 통하여 돈을 받고, 11월 초 쯤에나 잔금완납이 가능하다고 하더라구요저희는 9월 20일 전까지만 집단 대출이 가능한데 만약 세입자가 계약을 한다고 해놓고 계약을 취소해버리면 해당 대출을 못받게되서 그렇습니다. 저희가 잔금 대출을 받게 되고, 세입자로부터 전세금 잔금을 받아 다시 은행에 잔금대출상환을 하면 중도상환수수료 300정도 나온다고 알고 있는데 계약 취소를 감안해서 일단 신청을 해놓는게 맞을까요? 대출 이후 바로 갚아서 내는 중도상환수수료 300보다 중도금 상환 대출 납기일을 넘겨 연체되는 가산세 + 소유권 이전 등기 가산세 가 더 낮을 것 같긴 합니다.Q1. 이런 상황이면 일단 잔금 대출을 신청하는게 옳을까요? Q2. 또 세입자도 디딤돌 대출을 한다고 했었는데 저희가 은행 잔금 대출을 한다고 해서 심사에 탈락하거나 해서 대출에 불이익이 있을 수 있나요?Q3. 그리고 아파트를 전세로 판매하는 저희 상황에서 소유권 이전등기관련해서 주의할 상황이 있을까요? 저번에 잠깐 월세의 경우는 소유권 이전등기를 세입자 측에서 먼저하면 큰일난다고 들은적이 있어서요..",상관없을꺼예요 은행가서 연장되었다고 하시면 됩니다.아니면 새로운계약서 들고가시면ㅁ 됩니다 .​
전세,원래 계약은 7월까지인데 8월31일 까지로 미뤘었다가 다시 10월 11일로 미루게 되었습니다.첫번째 미뤘을때는 임대인이 부동산에 방문하여 잘 작성했는데 내일 다시 부동산 가서 10월11일로 미뤄야하는데임대인이 방문을 귀찮다고 거절합니다.1. 부동산에선 임대인분이 안오셔도 상관없다고 말씀 하시는데 상관이없나요?2. 전세대출이랑 보증보험 연장해야 되는데 새로운 임대차 계약서를 작성해야되는데 이경우 어떻게 해야하나요?AI 답변은 정중히 거절하겠습니다,"아파트 매매가가 4억9천-5억5천에 올려져 있다면, 전세가 4억 정도라면 비싼 수준이라고 볼 수 있습니다. ​일반적으로 전세가 비율은 매매가의 60% 정도가 안전하다고 볼수있습니다.​즉, 매매가가 4억9천-5억5천이라면 전세가는 2억9천4백만~3억3천만 원 정도가 적절한 수준입니다.​시세가4.9억~5.5억이면 경매시 보증금전액을 못 받을수도있습니다."
전세,"신혼부부라 이번에 전세집을 구하려고합니다그런데 아직 많이 무지해서 질문드립니다아파트 현재 매매가가 4억9천-5억5천 올려져 있는게 전세가 4억정도라면 비싼 수준인가요? 만약 그리고 최악으로 가정해서 집이 경매로 넘어간다고하면, 보증금을 돌려받을 수 있는 안전한 수준인지 궁금합니다.","안녕하세요. 서울지방변호사회-네이버 지식iN 상담 변호사 정종욱 입니다.​​금리인상 등으로 최근 전세집이 경매에 넘어가는 사례가 급증하고 있습니다. 전세집이 경매에 넘어간 경우 먼저 권리분석을 진행해 경매 배당절차에서 보증금 전액을 회수할 수 있는지를 따져보아야 합니다. 대항력있는 선순위 임차인이라면 낙찰자에게 보증금반환을 요구할 수 있기 때문에 상대적으로 안전한 편이지만, 최근 부동산 가격 하락으로 경매가 계속해서 유찰되는 현상이 나타나고 있습니다.​전세보증금보험을 가입하였다고 하더라도, 석연치 않은 이유들로 보증이행을 하지 않는 경우가 허다합니다. 보증보험회사의 입장에서도 세입자에게 보증채무를 이행한 뒤 집주인에게 구상권을 행사하여 보증금을 회수해야 하는데, 집주인으로부터 보증금회수가 불가능할 경우 이는 고스란히 보증보험회사의 손해로 귀속되기 때문입니다. 이 경우 보증금반환에 대한 부담은 고스란히 세입자가 부담하게 됩니다.​경매 배당 절차에서 보증금을 반환받지 못할 것이 확실한 경우에는 집주인을 상대로 보증금반환청구소송을 진행하신 후 신속하게 판결문을 확보해 집주인의 다른 재산에 강제집행절차를 진행하셔야 합니다. 경매 절차는 복잡한 편이고 진행과정에서 여러 변수가 많기 때문에, 보다 정확한 상담을 원하시면 관련자료를 지참해 전문 변호사와 상담을 진행해보시는 것이 좋습니다.​전세집이 경매에 넘어가는 깡통전세는 전세사기와 밀접한 관련이 있습니다. 최근 세입자들의 소중한 보증금을 떼어먹는 전세사기가 기승을 부리고 있어 세입자들의 각별한 주의가 필요한 상황입니다. 하지만 사기꾼들의 수법이 워낙 교묘하기 때문에 조심을 한다고 하더라도 눈 뜨고 코베이는 식으로 전세사기를 당하기 십상입니다. 전세사기에 대처하는 방법으로는 (1) 형사고소, (2) 보증금반환청구소송, (3) 채권추심/강제집행이 있습니다. 이 세 가지 절차가 유기적으로 진행되어야 전세사기 사건에서 피해를 회복할 수 있습니다.​최근 유행하는 갭투자 전세사기는 결국 갭투자 사기꾼이 남겨놓은 재산을 피해자들끼리 나눠먹기를 하는 형국으로 귀결되는 경우가 많습니다. 따라서 신속한 법적 조치를 취한 쪽이 그렇지 않은 쪽보다 유리할 수밖에 없습니다. 전세사기는 수년동안 그 형태가 진화해왔고, 그 수법이 사안마다 다르기 때문에 사안에 맞는 적절한 해결책을 찾기를 원하신다면 관련 자료를 지참해 전문 변호사와 상담을 진행해보시는 것이 좋습니다. ​참고하실만한 글을 소개해드립니다. 전세집이 경매에 넘어간 경우 대응방법, 부동산 전세사기 대응방법에 관해서는 아래 글을 참고하시면 도움이 되실 것입니다.​              전세집이 경매에 넘어갔는데 보증금을 반환받으려면 어떻게 해야 하나요? 전세집 경매 보증금반환 안녕하세요. 케이엔파트너스 부동산 법률연구소입니다. 저희 케이엔파트너스 부동... blog.naver.com                 [전세사기변호사.com] 전세사기 피해회복 3박자가 잘 맞아야 한다. 전세사기변호사가 알려주는 전세사기 피해회복 방법 세입자들의 소중한 보증금을 떼어먹는 전세사기 사건이... blog.naver.com            ​"
전세,"신축빌라에 2020.8월경 전세세입자로 입주하고 나서 1년이지난뒤에야 깡통전세인걸 알았습니다. 분양당시 매매가 3억2900만원           전세가 3억2900만원 이였고 전세 3억2900만원 으로 안심전세대출(90%대출)을 이용해 입주하였습니다.2021.1월 중순 조금 안된시점에 집주인이 바뀌었습니다.찾아보니 전형적인 건축주와 분양사무실과 바지사장을 이용한 무갭투기 깡통전세사기 인걸 인지하여부동산 등기를 확인해보았고현재상황은 이러합니다.입주하고나서 바로 전입신고 및 확정일자를 받았고, 그이전 을구에 있던 저당권설정은그이전 건축주(집주인)의 건축당시 은행대출로 보이고,계약서에 말소조건으로 기재후입주하였고 얼마안있어서 바로 말소되었습니다.그리고 몇달뒤에 집주인이 바뀌었습니다.현재갑구에 새로바뀐 집주인(바지사장) 앞으로 압류가 건강보험공단 및 지자체징수과 압류가들어와있고,전입신고 및 확정일자는 입주와동시에 했고,지금도 거주하고있고 한번도 전출을 한이력이없습니다그이후 집주인변경 및 새집주인 압류가 들어왔으므로다행히 저는 대항력있는 선순위 임차인으로 보입니다.을구에는 현재는 아무것도 없습니다.현재 전세 만기가 7개월 정도남은 상황이고,부동산 경매 예정통지서(현재바지사장집주인앞으로)온 통지서를 받게되었는데아마도 만기이전에 집이 경매로 넘어갈것같다고 판단됩니다.-------여기서부터 질문입니다. 1.제가알기로 집이 경매에 넘어가도 신축빌라이므로 현재 공시가가 2억3700 나옵니다(시세조회)그러면 감정가가 어떻게 될지는몰라도 2억~2억5천사이로 예상되는데이경우에 대항력있는 선순위 임차인인 제 보증금 3억2900만원보다도 낙찰가액이 적으므로제가 배당요구를 하든하지않든 분명 무한 유찰이 될것으로 보이고,그이전에 나머지후순위채권자가신청한 경매일경우 대항력있는 선순위임차인인 제가 존재하는한말소기준권리가 저의 임차보증금이 될텐데 경매가가 3억2900만원 이상이 되지않으면 무잉여기각이 될게 뻔한 상황인데이런경우에는 임차인인 제가 보증금반환소송 및 강제경매 신청후에입찰을 하고나서 낙찰가액과 배당액을 상계처리하면서인수할수 있다고 알고있는데요제가 강제경매를 신청후에 계속유찰시키면서 가장 저렴한금액으로 낙찰받아서구입하는게 나은지 아니면 첫회차에 바로 낙찰받는게 나은지 궁금합니다.2.현재 안심전세대출을 이용하고 있으므로낙찰받는순간 유주택자가 되어 안심전세대출을 일시납상환 하게되는걸로 알고있는데낙찰금액이야 상계처리하면 된다고하지만전세금상환하게 될시 어떻게 처리해야 할까요..? 이미 보유한 주택은주택담보대출도 많이 안나오는걸로 알고있습니다..3.아니면 제가 강제경매를 하지않고,채권자가 경매진행을 해도 무잉여기각이안나올수도 있을까요?4.종합적으로 봤을때 보증금 최대회수 및 이상황을 현명하게 넘길수있는 방법은 없을까요..?정말 전문가분들의 고견을 진심으로 여쭙숩니다 ..내공 많이 겁니다!!","안녕하세요. 서울지방변호사회-네이버 지식iN 상담 변호사 정종욱 입니다.​​금리인상 등으로 최근 전세집이 경매에 넘어가는 사례가 급증하고 있습니다. 전세집이 경매에 넘어간 경우 먼저 권리분석을 진행해 경매 배당절차에서 보증금 전액을 회수할 수 있는지를 따져보아야 합니다. 대항력있는 선순위 임차인이라면 낙찰자에게 보증금반환을 요구할 수 있기 때문에 상대적으로 안전한 편이지만, 최근 부동산 가격 하락으로 경매가 계속해서 유찰되는 현상이 나타나고 있습니다.​전세보증금보험을 가입하였다고 하더라도, 석연치 않은 이유들로 보증이행을 하지 않는 경우가 허다합니다. 보증보험회사의 입장에서도 세입자에게 보증채무를 이행한 뒤 집주인에게 구상권을 행사하여 보증금을 회수해야 하는데, 집주인으로부터 보증금회수가 불가능할 경우 이는 고스란히 보증보험회사의 손해로 귀속되기 때문입니다. 이 경우 보증금반환에 대한 부담은 고스란히 세입자가 부담하게 됩니다.​경매 배당 절차에서 보증금을 반환받지 못할 것이 확실한 경우에는 집주인을 상대로 보증금반환청구소송을 진행하신 후 신속하게 판결문을 확보해 집주인의 다른 재산에 강제집행절차를 진행하셔야 합니다. 경매 절차는 복잡한 편이고 진행과정에서 여러 변수가 많기 때문에, 보다 정확한 상담을 원하시면 관련자료를 지참해 전문 변호사와 상담을 진행해보시는 것이 좋습니다.​전세집이 경매에 넘어가는 깡통전세는 전세사기와 밀접한 관련이 있습니다. 최근 세입자들의 소중한 보증금을 떼어먹는 전세사기가 기승을 부리고 있어 세입자들의 각별한 주의가 필요한 상황입니다. 하지만 사기꾼들의 수법이 워낙 교묘하기 때문에 조심을 한다고 하더라도 눈 뜨고 코베이는 식으로 전세사기를 당하기 십상입니다. 전세사기에 대처하는 방법으로는 (1) 형사고소, (2) 보증금반환청구소송, (3) 채권추심/강제집행이 있습니다. 이 세 가지 절차가 유기적으로 진행되어야 전세사기 사건에서 피해를 회복할 수 있습니다.​최근 유행하는 갭투자 전세사기는 결국 갭투자 사기꾼이 남겨놓은 재산을 피해자들끼리 나눠먹기를 하는 형국으로 귀결되는 경우가 많습니다. 따라서 신속한 법적 조치를 취한 쪽이 그렇지 않은 쪽보다 유리할 수밖에 없습니다. 전세사기는 수년동안 그 형태가 진화해왔고, 그 수법이 사안마다 다르기 때문에 사안에 맞는 적절한 해결책을 찾기를 원하신다면 관련 자료를 지참해 전문 변호사와 상담을 진행해보시는 것이 좋습니다. ​참고하실만한 글을 소개해드립니다. 전세집이 경매에 넘어간 경우 대응방법, 부동산 전세사기 대응방법에 관해서는 아래 글을 참고하시면 도움이 되실 것입니다.​              전세집이 경매에 넘어갔는데 보증금을 반환받으려면 어떻게 해야 하나요? 전세집 경매 보증금반환 안녕하세요. 케이엔파트너스 부동산 법률연구소입니다. 저희 케이엔파트너스 부동... blog.naver.com                 [전세사기변호사.com] 전세사기 피해회복 3박자가 잘 맞아야 한다. 전세사기변호사가 알려주는 전세사기 피해회복 방법 세입자들의 소중한 보증금을 떼어먹는 전세사기 사건이... blog.naver.com            ​"
전세,집을 나가고자해서 알아보는 중인데요청년전월세대출이 있더라구요전세로가면 살만하지싶어서 관심이가는데이런쪽 지식이 아무것도 없습니다부동산에 청년대출을 받고싶다하면 절차나 세부사항을 안내해주시나요?전세로 살게된다면 신고절차등은 무엇을 해야하나요?또 특별히 무엇의 주의해야하거나 알아야하나요?,"안녕하세요. 서울지방변호사회-네이버 지식iN 상담 변호사 정종욱 입니다.​말씀하신 사안은 등기부등본, 주민등록초본, 임대차 계약서 등을 보아야 정확하게 판단이 가능할 것으로 보입니다. 자세한 상담을 원하시면 관련 자료를 지참해 전문 변호사와 상담을 진행하시는 것이 좋습니다. 갭투자로 다수의 부동산을 소유한 집주인에게 전세보증금을 떼이는 사례가 늘어나고 있습니다. 신속한 보증금 반환을 위해서는 필요한 법적 조치를 취하시는 것이 좋습니다. ​갭투자 전세사기 대응방법에 관해서는 아래 블로그 글을 참고하시면 도움이 되실 것입니다. ​              갭투자 전세 사기 대처방법은? 갭투자 전세사기 전세를 끼고 주택을 구입 후 시세가 올라가면 주택을 팔아 차익을 남기는 방법을 갭투자라... blog.naver.com            ​"
