구분,질문,답변
전세,전세집을 알아보다 친구가 전에 살았던 투룸건물 주인이랑 연락을해서 전세집을 보러 갔습니다 보고 나서 계약은 나중에 하겠다 했는데 집주인은 지금 일단 계약하고 나중에 파기해라 제가 돈이 없다는걸 말했고 수수료 줘야하지 않냐 했을때 필요없다 계약금도 나중에 줘라 해서 그 집주인 아는 부동산가서 계약을 했는데 제가 이틀날 안한다고 말하고 넘어갔습니다 근데 부동산에서 전화와서 43만원 중개수수료를 달라 합니다 이런 경우 줘야 하나요? 집주인 아저씨한테 전화했더니 자긴 15만원 줬으니 개네랑은 이젠 거래 안한다고 끊었습니다. 그리고 그 부동산이 저한테 내용증명까지 보냈습니다. 또 전화와서는 15만원만 달라고 하는겁니다 줘야 하는건가요ㅠㅠ 알려주세요,"부동산 전세계약을 위해 법무사를 부른 경우 수수료는 일반적으로 전세금의 일정 비율로 책정됩니다. 일반적으로 부동산 매매 거래의 경우 전세금의 1%에서 2% 정도를 수수료로 받는 것으로 알려져 있습니다.​따라서, 보증금 1억 5천 전세계약의 경우, 수수료는 약 1백만 원에서 3백만 원 정도가 예상됩니다. 다만, 이는 일반적인 기준이며 경우에 따라 법무사의 경험 및 역할에 따라 수수료가 조정될 수 있는 점을 고려해야 합니다.​정확한 수수료 책정은 법무사와 상담하여 결정하는 것이 가장 확실하며, 법무사에 따라 수수료 책정 방식 및 비율이 다를 수 있으므로 이에 대해 부담을 요구하기 전에 상담을 해보는 것을 추천합니다.​​​​"
전세,부동산 전세계약을 위해 법무사님과 함께 동행하고 싶은데요! 수수료가 어떻게 책정되는걸까용 궁금합니다!보증금 1억 5천 빌라전세 매물인데 만약 법무사님 부른다면 얼마정도 수수료가 들까요??,네 크게 문제는 없을것 같습니다 .​
전세,"이번에 전세 계약을 해야하는데매물이 다가구(건물 통째로 집주인 하나, 나머지 전세랑 월세 계약된 형태)입니다.그런데 중기청 대출은 되지만 보증보험이 안된다고 합니다.융자가 있어서 그렇다는데 다가구는 보증보험이 어려운게 일반적인가요? 공인중개사님의 말로는 전세 사기 위험성은 월세 계약과 전세계약의 비중이 중요한데 자기는 적당하다고 본다는데 괜찮을까요?","질문에 답변드리겟습니다.1)혹시나 매수인이 5월 15일에 잔금을 못치룬다면 계약이 파기인가요?==> 계약파기될 가능성이 높습니다. 이러한 경우 매도인은 매수인에게 계약해지절차를 준수해야 하는 만큼 시일이 어느 정도 더 소요될 수도 있습니다.2)계약서 상에는 5월15일에 잔금날이라고 전어두진 않았는데 쌍방 합의하에 잔금일을 떙길 수있다 적혀있어서 제가 5월15일에 모든 (임대인-매수인-부동산)에 통보후 녹음+캡처까지 해놓았습니다. 그럼 5월15일에 무조건 잔금을 치뤄야 하는지 궁금합니다.==> ""합의하 단축""이라는 용어는 서로 협의가 되지 않는다면 날자 만을 가지고 주장할 수는 없습니다.3)혹시라도 이런 이해관계에서 전세 사기가 발생할 수 있는지 궁금합니다. -전세세입자(저) + 현 임대인 + 매수인 + 미래에 생길수도 있는 전세 세입자==> 현재로서는 판단하기가 곤란합니다.4)5월15일에 잔금처리가 안된다면 이사짐은 다시 올리고, 대항력을 계속 가지고 있는게 맞는지 궁금합니다. ( 확정일자 + 전입신고 + 보증보험 ) 안전 장치는 모두 있습니다.==> 5. 15에 잔금처리가 되지 않는다면 전입신고 상태를 유지한 후 키도 넘겨 주지 말아야 점유상태를 인정받을 수가 있습니다.5) 5월 15일에 잔금이 못치뤄 진다면 저는 어떻게 하면 좋을까요.==> 4번 답변을 참고하시기 바랍니다."
전세,"안녕하세요. 부동산 전세계약만료 때문에 문의드립니다.5/26일날 전세계약 만기입니다. 지금 현 집주인에게 2달전 계약 해지 통보를 해둔 상태입니다. 현 집주인은 매매/전세 둘다 집을 내 놓았고 매매로 집이 3/11일에 새로운 매수인에게 팔린상태입니다.매도인 - 매수인 사이에 계약 시 5월30일날까지 잔금을 치룬다고 하고 계약금 일부(3월12일) 1800만원을 저에게 입금을 해주었습니다.계약서상 잔금일을 쌍방 합의하에 떙길 수 있다고 명시가 되어있었습니다.그래서 저는 5월15일에 이사를 나가겠다고 집주인-매수인-부동산에 전부 전달을 해두고 이사짐예약등등 모든 준비를 마친 상태입니다. 그러나 3월 말에 매수인이 전세를 내놓았습니다. 전세 세입자가 아직도 5/6일날까지 구해지지 않는 상태입니다. 매도인-매수인간 계약서 상에는 전세 세입자가 구해저야 잔금을 치룬다는 글이 적혀있지않아서 부동산에서는 5월15일에 무조건 잔금이 치뤄저야 한다고 합니다.1)혹시나 매수인이 5월 15일에 잔금을 못치룬다면 계약이 파기인가요?2)계약서 상에는 5월15일에 잔금날이라고 전어두진 않았는데 쌍방 합의하에 잔금일을 떙길 수있다 적혀있어서 제가 5월15일에 모든 (임대인-매수인-부동산)에 통보후 녹음+캡처까지 해놓았습니다. 그럼 5월15일에 무조건 잔금을 치뤄야 하는지 궁금합니다.3)혹시라도 이런 이해관계에서 전세 사기가 발생할 수 있는지 궁금합니다. -전세세입자(저) + 현 임대인 + 매수인 + 미래에 생길수도 있는 전세 세입자4)5월15일에 잔금처리가 안된다면 이사짐은 다시 올리고, 대항력을 계속 가지고 있는게 맞는지 궁금합니다. ( 확정일자 + 전입신고 + 보증보험 ) 안전 장치는 모두 있습니다.5) 5월 15일에 잔금이 못치뤄 진다면 저는 어떻게 하면 좋을까요.답변 부탁드립니다.","안녕하세요. 서울지방변호사회 소속으로 지식iN 법률상담을 진행하고 있는 정종욱 변호사입니다.​세입자의 소중한 보증금을 편취하는 부동산 전세사기 사건이 급증하고 있어 세입자들의 각별한 주의가 필요한 상황입니다. 부동산 전세사기 유형으로는 (1) 무자본 갭투자 깡통전세, (2) 권리관계 허위고지, (3) 신탁등기 전세사기, (4) 허위 보증보험 가입 등이 있습니다. 부동산 전세사기 사건의 해결책은 유형별로 다르기 때문에 자세한 대응방법은 관련자료를 지참해 전문 변호사와 상담을 진행해보시는 것이 좋습니다. 문의하신 사안의 경우 말씀해주신 사실관계가 불분명하여 정확한 판단이 어렵습니다. ​부동산 전세사기 대응방법에 관해서는 아래 블로그 글을 참고하시면 도움이 되실 것입니다. ​              부동산 전세사기, 부동산전문변호사가 유형별로 정리해보았습니다. 부동산 전세사기 유형별 정리 하루하루 열심히 살아가는 평범한 서민들을 울리는 전세사기가 기승을 부리고... blog.naver.com            ​"
전세,제가 hug안심대출로 전세들어왔는데 계약만료3달정도남았습니다아무도연락이되지않아 이거저거 찾아보고 알아보니 집주인이바뀐후 제가 한적도없는 월세계약에 확정일자가찍혀있더군요 이런상황엔 사문서위조죄로 고소를해야되나요? 정말 막막하고답답합니다... 도와주세요,"안녕하세요. 서울지방변호사회 소속으로 지식iN 법률상담을 진행하고 있는 정종욱 변호사입니다.​​​​금리인상 등으로 최근 전세집이 경매나 압류에 넘어가는 사례가 급증하고 있습니다. 전세집이 경매에 넘어간 경우 먼저 권리분석을 진행해 경매 배당절차에서 보증금 전액을 회수할 수 있는지를 따져보아야 합니다. 대항력있는 선순위 임차인이라면 낙찰자에게 보증금반환을 요구할 수 있기 때문에 상대적으로 안전한 편이지만, 최근 부동산 가격 하락으로 경매가 계속해서 유찰되는 현상이 나타나고 있습니다.​HUG 등 전세보증보험을 가입하였다고 하더라도, 석연치 않은 이유들로 보증이행을 하지 않는 경우가 허다합니다. 보증보험회사의 입장에서도 세입자에게 보증채무를 이행한 뒤 집주인에게 구상권을 행사하여 보증금을 회수해야 하는데, 집주인으로부터 보증금회수가 불가능할 경우 이는 고스란히 보증보험회사의 손해로 귀속되기 때문입니다. 이 경우 보증금반환에 대한 부담은 고스란히 세입자가 부담하게 됩니다.​경매 배당 절차에서 보증금을 반환받지 못할 것이 확실한 경우에는 집주인을 상대로 보증금반환청구소송을 진행하신 후 신속하게 판결문을 확보해 집주인의 다른 재산에 강제집행절차를 진행하셔야 합니다. 경매 절차는 복잡한 편이고 진행과정에서 여러 변수가 많기 때문에, 보다 정확한 상담을 원하시면 관련자료를 지참해 전문 변호사와 상담을 진행해보시는 것이 좋습니다.​전세집이 경매에 넘어가는 현상은 전세사기와 밀접한 관련이 있습니다. 깡통전세는 전형적인 전세사기 유형 중 하나입니다. 최근 세입자들의 소중한 보증금을 떼어먹는 전세사기가 기승을 부리고 있어 세입자들의 각별한 주의가 필요한 상황입니다. 하지만 사기꾼들의 수법이 워낙 교묘하기 때문에 조심을 한다고 하더라도 눈 뜨고 코베이는 식으로 전세사기를 당하기 십상입니다. 전세사기에 대처하는 방법으로는 (1) 형사고소, (2) 보증금반환청구소송, (3) 채권추심/강제집행이 있습니다. 이 세 가지 절차가 유기적으로 진행되어야 전세사기 사건에서 피해를 회복할 수 있습니다.​최근 유행하는 갭투자 전세사기는 결국 갭투자 사기꾼이 남겨놓은 재산을 피해자들끼리 나눠먹기를 하는 형국으로 귀결되는 경우가 많습니다. 따라서 신속한 법적 조치를 취한 쪽이 그렇지 않은 쪽보다 유리할 수밖에 없습니다. 전세사기는 수년동안 그 형태가 진화해왔고, 그 수법이 사안마다 다르기 때문에 사안에 맞는 적절한 해결책을 찾기를 원하신다면 관련 자료를 지참해 전문 변호사와 상담을 진행해보시는 것이 좋습니다.​참고하실만한 글을 소개해드립니다. 전세집이 경매에 넘어간 경우 대응방법, 부동산 전세사기 대응방법에 관해서는 아래 글을 참고하시면 도움이 되실 것입니다.              전세집이 경매에 넘어갔는데 보증금을 반환받으려면 어떻게 해야 하나요? 전세집 경매 보증금반환 안녕하세요. 케이엔파트너스 부동산 법률연구소입니다. 저희 케이엔파트너스 부동... blog.naver.com                 [전세사기변호사.com] 전세사기 피해회복 3박자가 잘 맞아야 한다. 전세사기변호사가 알려주는 전세사기 피해회복 방법 세입자들의 소중한 보증금을 떼어먹는 전세사기 사건이... blog.naver.com            ​"
전세,24년10월 만기 임차인입니다현상황은 집주인3주째 연락두절이고피해 세대가 40세대 입니다. 공지 보고 등기부 확인결과세무서 압류 23.8월입니다.허그 보증보험 가입상태이구요앞으로 진행은 어찌해야하는지 대략 알려주시면 감사하겠습니다,"안녕하세요. 서울지방변호사회 소속으로 지식iN 법률상담을 진행하고 있는 정종욱 변호사입니다.​​최근 세입자들의 소중한 보증금을 떼어먹는 전세사기가 기승을 부리고 있어 세입자들의 각별한 주의가 필요한 상황입니다. 하지만 사기꾼들의 수법이 워낙 교묘하기 때문에 조심을 한다고 하더라도 눈 뜨고 코베이는 식으로 전세사기를 당하기 십상입니다. 전세사기에 대처하는 방법으로는 (1) 형사고소, (2) 보증금반환청구소송, (3) 채권추심/강제집행이 있습니다. 이 세 가지 절차가 유기적으로 진행되어야 전세사기 사건에서 피해를 회복할 수 있습니다.​최근 유행하는 갭투자 전세사기는 결국 갭투자 사기꾼이 남겨놓은 재산을 피해자들끼리 나눠먹기를 하는 형국으로 귀결되는 경우가 많습니다. 따라서 신속한 법적 조치를 취한 쪽이 그렇지 않은 쪽보다 유리할 수밖에 없습니다. 전세사기는 수년동안 그 형태가 진화해왔고, 그 수법이 사안마다 다르기 때문에 사안에 맞는 적절한 해결책을 찾기를 원하신다면 관련 자료를 지참해 전문 변호사와 상담을 진행해보시는 것이 좋습니다. ​참고하실만한 글을 소개해드립니다. 부동산 전세사기 대응방법에 관해서는 아래 글을 참고하시면 도움이 되실 것입니다.              [전세사기변호사.com] 전세사기 피해회복 3박자가 잘 맞아야 한다. 전세사기변호사가 알려주는 전세사기 피해회복 방법 세입자들의 소중한 보증금을 떼어먹는 전세사기 사건이... blog.naver.com            ​"
전세,보통 부동산 끼고 하는걸로 알고있습니다부산에만 봐도 서면쪽에 부동산 소장은 골프치고 놀러다니며 사납금 30~50사이 자격증 대여 (일명 도장만 찍어주는 사람) 해주는사람들 테반이던데그러면 중개보조원들이 중개업무를 한다는건데불법으로 알고있습니다 빌라왕같은 사건은 일명 이런 무자격자들이 판치는 부동산에서 대부분 직방 다방 형태로 이루어지고 있으며그 무자격자 부동산들은 일명 양아치은행 (지점장들이 보수적이지 않은곳) 무차별전세대출 등등을 잘해준다고 합니다 문재인정권때는 기대도 안했는데 윤석열 대통령님 한동훈 법무부장관이 이런부분 손 안대줄까요?빌라왕 제일 기초는 무자격자 뿌리뽑는게 우선 아닐까요 법도 모르고 대출많은 빌라 등등 호구 임차인들 대부분 20~30 전세보증보험 된다는둥 둘러대며 계약 성사 시키면 100만원 받아가며 공인중개사 행세하던데.... 일단 공인중개사 협회부터 조져야할듯 합니다..방법이 없을까요? 혹여 한동훈 장관님 부하직원분들 등등 관계자 님들이 꼭 보셨으면 좋겠습니다변호사 직원들은 월급받고 일하던데솔직히 그냥 일반 부동산 소장들은 능력도 없으니까 최저시급 주는 형태로 법이 변하면 좋을껀데 방법이 없을까요?,안녕하세요. 서울지방변호사회-네이버 지식iN 상담 변호사 정종욱 입니다.​전세집이 경매에 넘어간 경우 대응방법에 관해서는 아래 블로그 글을 참고하시면 도움이 되실 것입니다. ​              전세집이 경매에 넘어갔는데 보증금을 반환받으려면 어떻게 해야 하나요? 전세집 경매 보증금반환 안녕하세요. 케이엔파트너스 부동산 법률연구소입니다. 저희 케이엔파트너스 부동... blog.naver.com            ​
전세,"안녕하세요. 질문사항 있어서 글 남겨요.사건의 개요는 아래와 같습니다.1. '20.8월경 전세 계약 체결(지방)   - 보증금 2천만원   - 전세보증보험은 가입 x   - 저당권 잡혀있었음(1건, 약 9천만원)   - 매매 시세는 1억~1억 2천정도2. '20.8월경(전세 계약 후) 동사무소 및 법원에 직접방문하여 전입신고 및 확정일자 받음3. '21.9월경 경매관련 서류 날라옴. 4. '21.9월 경매서류 받자말자 배당요구신청작성하여 법원에 직접방문함5. 부동산에 문의 해본 결과 경매기간동안 월세 및 관리비 안내도 된다고 함여기서 질문 드리겠습니다.1. 경매가 진행되는 동안 월세 및 관리비를 안내도 되나요?(부동산 말처럼)2. 경매가 완료되면 2천만원 금액을 전부다 받을 수 있나요? 아니면 저당권이 잡혀있는데  일정 비율로 받을 수 있나요?3. 혹여나 경매가 이루어지지 않으면 보증금은 받을 수 없을까요?","안녕하세요. 서울지방변호사회 소속으로 지식iN 법률상담을 진행하고 있는 정종욱 변호사입니다.​​최근 세입자들의 소중한 보증금을 떼어먹는 전세사기가 기승을 부리고 있어 세입자들의 각별한 주의가 필요한 상황입니다. 하지만 사기꾼들의 수법이 워낙 교묘하기 때문에 조심을 한다고 하더라도 눈 뜨고 코베이는 식으로 전세사기를 당하기 십상입니다. 전세사기는 수년간 그 수법이 진화되어 왔습니다. ​전세사기에 대처하는 방법으로는 (1) 형사고소, (2) 보증금반환청구소송, (3) 채권추심/강제집행이 있습니다. 이 세 가지 절차가 유기적으로 진행되어야 전세사기 사건에서 피해를 회복할 수 있습니다. 공인중개사가 전세사기에 적극 가담했다면 (4) 공인중개사 및 중개사협회에 대한 손해배상청구도 생각해볼 수 있습니다. ​HUG 등 전세보증보험을 가입하였다고 하더라도, 석연치 않은 이유들로 보증이행을 하지 않는 경우가 허다합니다. 보증보험회사의 입장에서도 세입자에게 보증채무를 이행한 뒤 집주인에게 구상권을 행사하여 보증금을 회수해야 하는데, 집주인으로부터 보증금회수가 불가능할 경우 이는 고스란히 보증보험회사의 손해로 귀속되기 때문입니다. 이 경우 보증금반환에 대한 부담은 고스란히 세입자가 부담하게 됩니다.​최근 유행하는 갭투자 전세사기는 결국 갭투자 사기꾼이 남겨놓은 재산을 피해자들끼리 나눠먹기를 하는 형국으로 귀결되는 경우가 많습니다. 따라서 신속한 법적 조치를 취한 쪽이 그렇지 않은 쪽보다 유리할 수밖에 없습니다. 전세사기는 수년동안 그 형태가 진화해왔고, 그 수법이 사안마다 다르기 때문에 사안에 맞는 적절한 해결책을 찾기를 원하신다면 관련 자료를 지참해 전문 변호사와 상담을 진행해보시는 것이 좋습니다. ​참고하실만한 글을 소개해드립니다. 부동산 전세사기 대응방법에 관해서는 아래 글을 참고하시면 도움이 되실 것입니다.​              [전세사기변호사.com] 전세사기 피해회복 3박자가 잘 맞아야 한다. 전세사기변호사가 알려주는 전세사기 피해회복 방법 세입자들의 소중한 보증금을 떼어먹는 전세사기 사건이... blog.naver.com            ​"
전세,21년 11월 에 계약을 했고 이번년도 11월이면 계약만기일자입니다 산지 몇개월쯤 되었을때 비가 새더군요 그래서 계약서에 적혀져있던 번호 저장후 연락을 주고받고 오셨었는데 본인이 동생이라더군요 몇채를 관리하는데 형은 서울로 이사를 가서 여기지역은 본인이 관리한다면서요 그래서 아그렇군요 하고 고쳐지지않아서 1년가까이 연락을 주고받고 얼굴뵙기를 여러번 저도 지쳐서 그래 그냥 냅두자 했습니다 근데 부동산에서 얼마전 연락이 오더군요 집주인이 집을 내놨다면서요 근데 연락이 안된다면서 번호 알려달라더군요 저도 전화해봤지만 이미 바뀐번호구요 그랴서 부동산측이랑 전화를 했더니 사실은 이미 2.3월쯤 집을 내놨고 그뒤로 잠수를 탔다는겁니다 자기도 모른다고 저는 뒤늦게 계약서를 찾아봤고 아차 싶었습니다 계약당시 집주인분은 10분본게 다입니다 그 번호는 저랑 연락주고받았던 동생번호구요 그랴서 알고계셨냐 물어보니 탸연하게 아그래요? 하면서 근데 그사람 친동생 아닌데 ..하면서 ...어처구니가없어서 자꾸 경매에 넘기라더군요여기서 제가 궁굼한건1.부동산도 한패인거 같은 느낌인데 물증은 없습니다 .증거가 문자나 녹취록이 있으면 부동산도 책임을 물을수 있는지 2.내용증명 보내고있고 동사무소가서 초본떼면 바뀐주소지가 나온다더군요 그럼 제가 찾아도 돈없다고 하면 어떻게 해야되는지3.경매에 넘겨지면 돈 다 돌려받을수 있는지 (전세1억에 들어왔고 시세가 많이 떨어져서 지금 8천 언저리입니다)은행에서는 일단 묵시적 연장 가능하다고 하는데 저는 그 집에 살고싶지않은데 못갚으면 제 신용에 타격이 크답니다 만기가 남아서 이러지도 저러지도 못하고있어요 어쩌면 좋을까요.....,"안녕하세요. 서울지방변호사회-네이버 지식iN 상담 변호사 김성민 입니다.​-2번 조항과 관련하여 등기부등본을 확인하는 것이 좋을 듯 합니다.​-선순위 근저당권이 있는 지 여부, 없다면 2번 특약은 관용문구일 뿐 아무런 의미가 없습니다. 선순위 근저당권이 있다면, 채권최고액을 제외하고 대출가능금액이 있으며 그 금액으로 대출이 가능합니다. 이에 대한 설명의무를 다하였다는 것을 확인한 특약일 것으로 보입니다​-위험판단은 은행에서 선순위 근저당권 등을 고려하여 할 것으로 보입니다. 다만 선순위 근저당권이 있다면, 대출이 이루어졌을 시에 전세보증보험에 가입하시는 것이 좋을 듯 합니다"
전세,"전세계약을 했는데요, 오늘 대출을 받으러 가니 은행 창구 직원이 특약사항을 읽고 이러한 조항이 있어도 되는 게 맞는지 확인해보라고 하더라구요부동산에 전화했더니 문제 있는 조항은 없다고 하는데 혹시 몰라서요1. 현 시설물 상태에서 임대차한다.2. 임차인은 위 부동산에 존재하는 선순위 권리(근저당, 임차권 등)로 인하여 경매 등이 실행될 경우 임차보증금의 전부 또는 일부를 반환받지 못할 수도 있음을 확인한다.3. 임대할 부분의 면적은 (공부상 전용면적 또는 연면적, 실측면적)이다.4. 기타사항은민법 임대차보호법 및 부동산임대차 계약 일반 관례에 따르기로 한다.5. 임대, 임차인은 계약서 작성을 위한 개인정보활용에 동의한다.6. 첨부서류: 등기사항증명서, 중개대상물확인설명서, 공제증서제가 걱정되는 부분은 2번인데요혹시 문제 발생시 2번때문에 임차인에게 불리하게 작용할까요?","안녕하세요. 서울지방변호사회 소속으로 지식iN 법률상담을 진행하고 있는 최성민 변호사입니다.​최근 세입자들의 소중한 보증금을 떼어먹는 전세사기가 기승을 부리고 있어 세입자들의 각별한 주의가 필요한 상황입니다. 하지만 아무리 조심한다고 하더라도 전세사기 수법이 워낙 교묘하여 눈뜨고 코베이는 식으로 전세사기를 당하는 경우가 허다합니다. 전세사기 사건에 휘말리게 되었을 경우 신속한 법적 조치로 피해회복을 도모하셔야 합니다. 전세사기 사건에 대응하는 방법으로는 형사고소, 보증금반환청구소송, 채권추심이 있습니다. 문의하신 내용이 불분명하여 일반론적인 답변밖에 드릴 수가 없는데, 전세사기 피해회복 방법이 궁금하시다면 아래 블로그 글을 참고하시면 도움이 되실 것입니다. ​              [대치동 부동산전문변호사] 빌라/오피스텔 전세사기, 보증금반환 받을 수 있을까? 빌라/오피스텔 전세사기 보증금반환 깡통전세, 전세사기 사건에 휘말려 소중한 보증금을 잃게 될까봐 노심... blog.naver.com            ​"
전세,[],"안녕하세요. 서울지방변호사회 소속으로 지식iN 법률상담을 진행하고 있는 최성민 변호사입니다.​최근 세입자들의 소중한 보증금을 떼어먹는 전세사기가 기승을 부리고 있어 세입자들의 각별한 주의가 필요한 상황입니다. 하지만 아무리 조심한다고 하더라도 전세사기 수법이 워낙 교묘하여 눈뜨고 코베이는 식으로 전세사기를 당하는 경우가 허다합니다. 전세사기 사건에 휘말리게 되었을 경우 신속한 법적 조치로 피해회복을 도모하셔야 합니다. 전세사기 사건에 대응하는 방법으로는 형사고소, 보증금반환청구소송, 채권추심이 있습니다. 문의하신 내용이 불분명하여 일반론적인 답변밖에 드릴 수가 없는데, 전세사기 피해회복 방법이 궁금하시다면 아래 블로그 글을 참고하시면 도움이 되실 것입니다. ​              [대치동 부동산전문변호사] 빌라/오피스텔 전세사기, 보증금반환 받을 수 있을까? 빌라/오피스텔 전세사기 보증금반환 깡통전세, 전세사기 사건에 휘말려 소중한 보증금을 잃게 될까봐 노심... blog.naver.com            ​"
